节点编号,原文,设计行为,源节点
1,然后这个的话我觉得可能主要要先看一下他的目标人群是中老年，然后呃。以及它的需求是健康以及陪伴这两个点，然后那设计的话可能会主要从嗯这两个方面入手,基于功能的分析,0
2,然后中老年的话我觉得。嗯，一方面就是他们可能到这个年龄。的时候，整个机体功能会有一些退化啊,基于功能的分析,1
3,也就导致他们可能记忆力不太好,基于功能的分析,2
4,所以我可能想到的第一个就是，呃，会帮助他们做一些日常事物的提醒,概念合成-功能,3
5,日程提醒他可以就是前一天把一些比较重要的事情都跟机器人说一下，然后机器人帮他规划好时间，然后到时候定点给他做一个呃，说明,概念合成-行为,4
6,这样的话相当于是他自己身边的一个小助手。然后就可以很好的去呃，帮助他安排自己的生活,基于功能的评估,5
7,然后另外的话中老年他可能还会有很多就是呃，就是有些慢性病嘛，可能慢慢的出现了，需要去吃药,基于功能的分析,1
8,然后那这个时候其实我觉得也是。很必要的告诉他你需要吃什么药,基于行为的分析,7
9,然后呃你有没有吃，可能他们对这个记得也不是特别清，容易记混了,基于功能的先例,7
10,然后我觉得就是在什么日程提醒啊，包括一些重要的。日子。嗯，比如说还有什么体检，然后还有吃药，这些可能都要跟他们说一下。,概念合成-行为,5;9
11,然后另外的话我觉得。呃，健康陪伴可能还有一个点就是可以去监控他们的一些身体数据,概念合成-功能,0
12,然后及时的去给他们一些呃就是呃意见啊，反馈啊什么的，或者是联系他的子女和和这个医院,概念合成-行为,11
13,嗯，因为我觉得这个东这个机器人他可能他的受众不仅是中老年，呃，还有是他的儿女嘛。,基于功能的分析,12
14,这个也是儿女非常关心的，有这么一个机器人在，然后他会比较安心,基于功能的评估,13
15,还需要去考虑到这个机器人，他能不能和周围的一些设备进行联动,概念合成-功能,11
16,嗯，然后比如说这个呃，家里常用的一些血压计啊，还有呃，血糖计啊，然后这些东西它都可以把测出来的数据上传上来,概念合成-功能,15
17,就是它可能有一些云端。呃，就是互联的功能,概念合成-功能,15;16
18,然后如果没有这么高级的功能呢，其实也是可以，就是比如说我们设置让这个机器人他每天。呃，给他设置一些提醒,概念合成-功能,17;4
19,说你该测血糖了，测完血糖这个机器人就问他一下，哎，你这个血糖值是多少啊？然后他做一个记录，,概念合成-行为,18
20,然后这样的话慢慢的也可以帮这个家里的中老年人形成一个健康档案,基于行为的评估,19
21,嗯，还可以给他一些事实的提醒，比如说是不是该去医院体检了什么的？,概念合成-行为,18
22,另外还有啥呀？健康陪伴机器人！健康饮食吗？健康饮食给他根据他前面的这些情况，然后给他一些推荐吃点啥,概念合成-行为,18
23,然后陪伴的话可能还有一些聊天什么的功能,基于功能的分析,0
24,以及他们可能想听一些什么东西控制一下家里的设备能不能行啊,基于功能的分析,0
25,比如说他可能有很多东西。它不是很好的去找,基于功能的先例,24
26,现在不是这个，我们这个CG PT它有这个呃AI聊天吗？然后可能这个东西也可以和我们的机器人做一个结合。,基于行为的先例,23
27,这样的话，呃，如果老人他想了解一些什么东西，又不太方便，去搜索的时候，可以直接以对话的形式进行一个检索。,概念合成-行为,26
28,嗯。然后就可以解决一些生活中遇到的难题。,基于行为的评估,27
29,还有的话就是考虑到中老年可能。他们还有带孩子的需求？那这个中陪伴机器人是不是也可以在这个方面给他们带带来一些帮助？,基于功能的分析,0
30,比如说。是不是也有什么儿童模式呀？,概念合成-功能,29
31,或者说他可以给孩子播放一些儿歌呀？,概念合成-功能,29
32,这样的就是辅助我们的中老年人，帮助他们带孩子。,基于功能的评估,31
33,嗯，以及说可能。嗯，这个嗯，他没在，他没在孩子旁边，这个机器人能不能也稍微做到一些看护孩子都。作用。有什么问题可以及时的发出一些警报啊之类的。,基于功能的评估,31
34,我们老年有一些健康需求。有一些生理限制。机体限制。技能。,基于功能的分析,0
35,考虑到他的技能限制。需要给他更多的帮助。,基于功能的分析,34
36,"第一个类型的就是一个助理,偏向给给一些。生活层面的帮助。和情感陪伴。",概念合成-功能,35
37,可以进行一些检索呀！,概念合成-功能,36;27
38,然后另外的话就是可以给他一些。诶。生活方面的提醒和帮助,概念合成-功能,36;18
39,提供陪伴。比如说听听收音机。那眼神不太好了，就听一些东西。听音乐，然后听广播。嗯，听各种东西。,概念合成-功能,36
40,第二个呢。它是一个健康型的。那更倾向于用在一些身体数据的监测。,基于功能的分析,35
41,它本身的一些部位是可以作为一个检监测仪器的监测仪器。,概念合成-结构,40
42,那这样的话，比如说他要测我们的血压，就可以直接把手伸到他的胳膊上，他给我们调整到一个比较合适的位置，就可以给我们测血压了，然后测血糖呢也是这样。,概念合成-行为,41
43,这样的话就是因为本身机器人他自己是智能的嘛，嗯，他可以自动的测完之后。把这些数据上传上传上去，,概念合成-功能,42
44,然后呢，也可以及时的对相关的一些仪器做一个消毒处理，,概念合成-功能,42
45,然后觉得比较好管理，这个老人也不会说忘掉，忘记忘记这个东西放在哪里了，直接一个机器人叫过来就可以。,基于功能的评估,42
46,这个机器人的话，因为它是相当于一个健康的管家嘛，它也可以是根据这个呃，中老年他们自己的身体状况进行一个。私人定制的,概念合成-功能,40
47,比如说有的老人，他就是血糖高，血压高，那我们可能就更多的会需要去测一些这些相关的内容。,概念合成-功能,46
48,那如果说这个造价非常的贵，我们不方或者不方便把它们都集成在一起，那我觉得这个机器人它本身也是可以大一点。,基于结构的分析,41
49,大一点也可以的吧，作为一个储物的空间，因为我们把它作为一个健康型的机器人，就可以在下面放一些，比如说呃，一些可能有很好多不同的。储物空间，,概念合成-结构,48
50,然后这些空间呢，它会有不同的温度设定，这些设定的话就方便，比如说有一些嗯。呃，胰岛素啊，就可以放在里面,概念合成-结构,49
51,然后。那这个样子的话。就比较便于收纳嘛！,基于结构的评估,49
52,就是，那我买回来，可能老人一开始有一些抵触，觉得这玩意儿有用吗？那我有了这样的一个储物空间，第二功能的设定之后，可能他也更加愿意接受吧。,基于结构的评估,51
53,嗯，那既然它有了一个储物空间的设定之后，其实也就引申出它后边的一个功能，就是那这个东西少了，是不是需要补充了，那它也可以及时的进行一个记录。,概念合成-功能,49
54,嗯，那另外呢，像健康型的我觉得。也就是这个儿女比较关注的，就是说这个爸爸妈妈他们身体数据到底是什么样子的呀？是不是呃，就有什么不舒服的地方呀？是不是需要给他们联系一些检查呀？,基于功能的先例,40
55,那这样的话可能也是需要一个儿女数据推送。,概念合成-功能,54
56,然后这样的话就是可以。临时监测。然后做一些？检查的预约。,基于功能的评估,55
57,然后第三点就是协助带孩子。因为带孩子确实是。很费心力的一件事情。,基于功能的分析,0
58,可能你因为看小孩儿就很多，其他的事情都没有办法去做了,基于功能的先例,57
59,所以说可能你去解决中老年他们。带孩子这边的一部分看护需求也可以在一定一定程度上减缓他们的一些呃生活上的压力。我觉得也是挺有必要的。,基于功能的评估,58
60,那个这个带孩子型呢？比如说它会有两种模式，一个是呢是我孩子不在我身边，或者说我还没到那个阶段。那我就是一个。普通的。啊，个人模式？那如果说后边儿我家有小孩儿了，或者孩子来身边了，我就给他切换为儿童模式，,概念合成-行为,57
61,那儿童模式的话可能呃会有一些什么，首先防误触啊，童锁功能啊,概念合成-功能,60
62,然后另外呢就是可能呃老人他想去看孩子，但是呃就是想给孩子听一些歌。或者是给他讲一些故事，但是呢，他又用不惯一些电子设备,基于功能的先例,59
63,那这个时候我们就可以用这个智能机器人通过语音对话的方式，让他给孩子去挑选一些合适的故事，去做一些保护早教方面的内容。,概念合成-行为,62
64,嗯，因为像我家哈，我家有一个小孩啊，我妈很想去教孩子学英语，但是我妈她自己其实是不太会英语的，那这个时候她就很苦恼，然后有时候会让我去网上下载一些呃，英语的那种呃。那种那种字母表的嗯，老师去读的这种视频，然后让孩子去跟读。,基于行为的先例,62
65,就是，呃，那老人他们其实都是希望孩子在，呃，带带孩子的过程中能够教孩子更多的东西嘛，然后也希望教这个东西，他能够是比较准确的有用的,基于功能的分析,64
66,也是可以减缓他们的一些嗯一些什么呢？可以满足他们的一些需求吧？,基于功能的评估,65
67,嗯，那这个的话就是儿童的内容，这些内容可能会包括一些知识学学习，然后还有一些儿歌儿娱乐歌曲。,概念合成-功能,63
68,那儿童除了关心儿童，没有关心老人自己，,基于功能的评估,67
69,那在老人的个人模式里边儿可能就是会有一些。这个就比较偏前面那个陪伴型了。就是也是可以给他一些生活方面的陪伴娱乐。,概念合成-功能,68;36
70,一些那个遇到一些问题呀，可以问问。哎呀，对话一下可以怎么办呀？,概念合成-行为,69
71,协助带孩子行，其实就相当于说在本来的这个陪伴型的基础上加了一个儿童模式。,基于功能的评估,70
72,刚才有讲到说看护。那他得有一些什么监控啊？,基于功能的分析,59
73,那老人有手机可以用这个监控。嗯，那这样的话他还可以远程语音。跟孩子对话。,概念合成-行为,72
74,那个健康饮食还要吗？,基于功能的评估,22
75,其实我觉得中老年的饮食他们还是蛮健康的，也不需要特定的给他们说什么。又做不出来，你只靠说又能怎么样呢,基于功能的先例,74
76,这一般像一些健康方面的食谱啊，或者是说比如说你高血糖吃什么比较好，我觉得这些内容是可以,概念合成-功能,75
77,就是可能有一些行动不便的老人，那这个机器人。可以在家里当成一个帮他跑腿的工具,基于功能的分析,0
78,但是这样的话就需要这个机器人，它有非常灵活的一些呃，机械抓手的设备啊,概念合成-结构,77
79,感觉是还是有点困难。,基于结构的评估,78
80,其其实我觉得如果说这个老人都行动不便了，家里家里肯定是有其他人的，所以这个需求也就那样吧,基于功能的评估,77
