节点编号,原文,设计行为,源节点
1,我先考虑到中老年人的需求，先从行为上来找他们有什么比较需要的点,基于功能的分析,0.0
2,健康信息可能会有，日常生理数据的记录然后会分析他有没有什么比较不正常的体标指标不正常的指偏离指标。,基于功能的先例,1.0
3,陪伴可能聊天。ai聊天功能会扮演子女的角色。最好可以模拟子女的语音，搜集足够多的数据,基于功能的先例,2.0
4,中老年人肯定会有一些学习、自我提升的需求,基于功能的分析,1.0
5,比如说可以教学，写毛笔字，或者是跳舞。中老年人可能是会有一些外语学习各种方面的学习需求,概念合成-功能,4.0
6,可以作为家庭教师，是一个移动机器人,概念合成-结构,5.0
7,最重要的肯定还是健康。健康可能是日常方面的监督,基于功能的分析,1.0
8,比如每日食谱，如果老年中老年人自己。不想买菜可能还有上门服务，帮忙买菜,概念合成-功能,8.0
9,主要还是帮助他日常的身体健康、饮食健康。上面如果是有是有一些慢性病，能会分析监测便可。,概念合成-功能,9.0
10,结构创新，便携移动、可移动的机器人。,概念合成-结构,0.0
11,不够创新。我要再创新一点的机器人,基于结构的评估,10.0
12,可能是桌面产品,概念合成-结构,11.0
13,中老年人会用哪些特殊的活动,基于行为的分析,1.0
14,可能会有一些娱乐功能，锻炼手部肌肉,基于功能的先例,13.0
15,锻炼的同时聊天、同时界面反馈机器人比如表情,概念合成-行为,14.0
16,还可以有穿戴设备,概念合成-结构,11.0
17,多模块的交互玩具型机器人,概念合成-结构,11.0
18,穿戴设备可以记录生理数据，带出门,概念合成-功能,16.0
19,在玩玩具的同时锻炼，针对特殊的慢性病人,基于功能的评估,17.0
20,家庭移动机器人可能是一种电子宠物，有陪伴功能,概念合成-功能,10.0
21,可以携带出门，技术上需要比较创新,概念合成-结构,20.0
22,桌面产品可以有智能语音主动交互，比如做菜、起床睡觉、广场舞，起到陪伴作用,概念合成-功能,12.0
23,提醒中老年人日常生活中的日常事务,概念合成-功能,22.0
24,还有老年人可能需要家人陪伴去医院，可能日常生活中会有一些家庭医生,基于功能的先例,1.0
25,也需要远程连线医生、吃药、复查等,基于功能的先例,24.0
26,可以把ai聊天记录下的关键信息告知子女，比如最近在做什么，有什么问题，对什么感兴趣，想吃什么,概念合成-功能,25.0
27,老人还有社交需求,基于功能的分析,1.0
28,独居的空巢中年老人，通过机器人与他人配对，结伴出行。如结伴买菜一起吃饭、散步、下棋、锻炼、遛狗等,概念合成-功能,27.0
29,机器人会安排规划行程、进行导航、安全保障、实时的定位，作为助手帮助社交活动,概念合成-功能,28.0
30,首先是便携可移动机器人，可能是电子狗，需要一些技术创新,基于结构的分析,10.0
31,但是很多人感觉不能接受,基于结构的评估,30.0
32,可以通过传感器记录健康信息，记录各项指标，比如心率，口腔健康等,概念合成-功能,30.0
33,桌面产品可以进行智能安全的配对,概念合成-功能,29.0
34,可以进行在线指导，户外活动时通知家人,概念合成-功能,16.0
